title,url,publishedAt,source,snippet
The US Will Stand Alone Outside the World’s Climate Treaty,https://gizmodo.com/the-us-will-stand-alone-outside-the-worlds-climate-treaty-2000707741,2026-01-08T20:10:02Z,NewsAPI,
Europe’s not-so-dry January: Unicorns and a new tech identity,https://thenextweb.com/news/europes-not-so-dry-january-unicorns-and-a-new-tech-identity,2026-02-02T12:31:28Z,NewsAPI,
"Web3 Platform Roundtable Signs Cowboys Media Icon Mike Fisher, After 150 Elite Journalists Exit Sports Illustrated to Reunite with Founder James Heckman",https://www.thestreet.com/crypto/markets/web3-platform-roundtable-signs-cowboys-media-icon-mike-fisher-after-150-elite-journalists-exit-sports-illustrated-to-reunite-with-founder-james-heckman-,2026-01-05T20:26:39Z,NewsAPI,
Meta makes drastic workforce decision after $73 billion in losses,https://www.thestreet.com/employment/meta-makes-drastic-workforce-decision-after-73-billion-in-losses,2026-01-14T18:17:00Z,NewsAPI,
ThinkPad X1 Carbon Gen 14 Aura Edition Scores 9/10 From iFixit at CES 2026,https://www.yankodesign.com/2026/01/06/thinkpad-x1-carbon-gen-14-aura-edition-scores-9-10-from-ifixit-at-ces-2026/,2026-01-07T01:22:02Z,NewsAPI,
Reaction to the US-India tariff deal,https://sg.finance.yahoo.com/news/reaction-us-india-tariff-deal-022821112.html,2026-02-03T02:28:21Z,NewsAPI,
Businesses are struggling to achieve AI success - this report reveals why,https://www.techradar.com/pro/businesses-are-struggling-to-achieve-ai-success-this-report-reveals-why,2026-01-16T17:20:00Z,NewsAPI,
Dietitians Share the Best Diets for Weight Loss in 2026,https://www.prevention.com/weight-loss/diets/a69949519/best-diets-for-weight-loss-2026/,2026-01-13T16:59:00Z,NewsAPI,
Mannheimer Startup wird erstes Einhorn des Jahres in Deutschland – Blackrock und Temasek investieren 100 Millionen Dollar,https://www.businessinsider.de/gruenderszene/mannheimer-startup-wird-erstes-einhorn-des-jahres-in-deutschland/,2026-01-14T11:24:51Z,NewsAPI,
Blackrock katapultiert dieses deutsche Startup zur Milliarden-Bewertung,https://www.businessinsider.de/gruenderszene/blackrock-katapultiert-dieses-deutsche-startup-zur-milliarden-bewertung/,2026-01-16T15:00:24Z,NewsAPI,
AI’s growing thirst for water is becoming a public health risk,https://www.aljazeera.com/opinions/2026/1/21/ais-growing-thirst-for-water-is-becoming-a-public-health-risk,2026-01-21T12:04:40Z,NewsAPI,
The AI Power List,https://www.businessinsider.com/ai-power-list,2026-01-06T10:20:01Z,NewsAPI,
16 Best Practices for Reducing Dependabot Noise,https://nesbitt.io/2026/01/10/16-best-practices-for-reducing-dependabot-noise.html,2026-01-12T03:56:07Z,NewsAPI,
Why the FIA is so confident in unprecedented F1 2026 rule changes,https://www.autosport.com/f1/news/why-the-fia-is-so-confident-in-unprecedented-f1-2026-rule-changes/10793240/,2026-01-27T16:26:45Z,NewsAPI,
"Financial Times, Twitch and Politico are among the winners of this year’s Digiday Media Awards Europe",http://digiday.com/media/financial-times-twitch-and-politico-are-among-the-winners-of-this-years-digiday-media-awards-europe/,2026-02-03T17:38:31Z,NewsAPI,
2025 ESG Wrap-Up and 2026 Outlook,https://corpgov.law.harvard.edu/2026/01/24/2025-esg-wrap-up-and-2026-outlook/,2026-01-24T12:30:43Z,NewsAPI,
"AI spending frenzy could reshape the economy, Bridgewater CIOs say",https://finance.yahoo.com/news/ai-spending-frenzy-could-reshape-162521023.html,2026-01-26T16:25:21Z,NewsAPI,
"Stock market today: Dow, S&P 500, Nasdaq slide after Trump picks Warsh for Fed; gold, silver plunge",https://finance.yahoo.com/news/live/stock-market-today-dow-sp-500-nasdaq-slide-after-trump-picks-warsh-for-fed-gold-silver-plunge-181435040.html,2026-01-30T18:14:35Z,NewsAPI,
Strategy kickstarts 2026 with $116M Bitcoin buy as Q4 paper loss hits $17B,https://cointelegraph.com/news/strategy-2026-116m-bitcoin-buy-17b-loss-q4,2026-01-05T14:20:01Z,NewsAPI,
Why Sustainability in the Supply Chain Is a Design Problem,https://logisticsviewpoints.com/2026/01/21/why-sustainability-in-the-supply-chain-is-a-design-problem/,2026-01-21T16:40:40Z,NewsAPI,
"Financial Times, Twitch and Politico are among the winners of this year’s Digiday Media Awards Europe",http://digiday.com/announcement/financial-times-twitch-and-politico-are-among-the-winners-of-this-years-digiday-media-awards-europe/,2026-02-03T17:38:31Z,NewsAPI,
EU Parliament backs Omnibus I reducing CSRD and CSDDD scope,https://www.theaccountant-online.com/news/eu-parliament-backs-omnibus/,2026-01-09T14:51:40Z,NewsAPI,
SSBJ/CSRD等のサステナビリティ情報開示を　Ridgelinez、「戦略・ガバナンス×業務プロセス×システム」までEnd to Endで支援するサービスを提供開始,https://prtimes.jp/main/html/rd/p/000000090.000081732.html,2026-01-13T05:40:30Z,NewsAPI,
Financial Expert: OpenAI's Long-Term Viability in Question as It Burns Billions,https://www.breitbart.com/tech/2026/01/15/financial-expert-openais-long-term-viability-as-it-burns-billions/,2026-01-15T19:03:03Z,NewsAPI,
Mitigating emissions from air freight: Unlocking the potential of SAF with book and claim,https://www.technologyreview.com/2026/01/12/1128939/mitigating-emissions-from-air-freight-unlocking-the-potential-of-saf-with-book-and-claim/,2026-01-12T14:00:00Z,NewsAPI,
MICE Tourism and the Rising Importance of Sustainability,https://www.hospitalitynet.org/news/4130340.html,2026-01-07T00:21:34Z,NewsAPI,
"ASML projects $71 billion in revenue by 2030, as demand for EUV lithography machines intensifies due to AI boom — China sales lag behind while company cashes in on high-end Twinscan systems",https://www.tomshardware.com/tech-industry/semiconductors/asml-projects-usd71-billion-in-revenue-by-2030-as-demand-for-euv-lithography-machines-intensifies-due-to-ai-boom-china-sales-lag-behind-while-company-cashes-in-on-high-end-twinscan-systems,2026-01-29T12:39:22Z,NewsAPI,
Sustainability is Everywhere: Except in Hospitality Culture,https://www.hospitalitynet.org/opinion/4130719.html,2026-02-03T12:48:14Z,NewsAPI,
Finance Consultant – Arts FMS,https://www.artsjournal.com/2026/01/finance-consultant-arts-fms-5.html,2026-01-05T22:14:46Z,NewsAPI,
Selfridges launches beauty waste recycling across all four stores,https://www.luxurydaily.com/selfridges-launches-beauty-waste-recycling-across-all-four-stores/,2026-01-29T21:50:03Z,NewsAPI,
CoreWeave Stock Soars as CEO Rebuts Critics. Is the AI Stock a Buy Again?,https://247wallst.com/investing/2026/01/13/coreweave-stock-soars-as-ceo-rebuts-critics-is-the-ai-stock-a-buy-again/,2026-01-13T14:21:35Z,NewsAPI,
USALI 12 and Energy: Understanding the New Reporting Framework,https://www.hospitalitynet.org/news/4130514.html,2026-01-21T09:07:06Z,NewsAPI,
Sweep to Lead CDP Reporting Workshop at Sustainability LIVE: The Net Zero Summit 2026,https://www.globenewswire.com/news-release/2026/02/03/3231350/0/en/Sweep-to-Lead-CDP-Reporting-Workshop-at-Sustainability-LIVE-The-Net-Zero-Summit-2026.html,2026-02-03T16:00:00Z,NewsAPI,
Industrial AI applied: where the real revolution is happening,https://www.techradar.com/pro/industrial-ai-applied-where-the-real-revolution-is-happening,2026-01-09T15:01:13Z,NewsAPI,
Security teams are paying more attention to the energy cost of detection,https://www.helpnetsecurity.com/2026/01/09/energy-aware-cybersecurity-ai-research/,2026-01-09T06:00:21Z,NewsAPI,
From volatility to control: How intelligence will redefine food systems in 2026,https://www.thehindubusinessline.com/economy/agri-business/from-volatility-to-control-how-intelligence-will-redefine-food-systems-in-2026/article70495566.ece,2026-01-11T05:30:00Z,NewsAPI,
Greening up Europe’s data centres is a major policy challenge for 2026,https://biztoc.com/x/a44d8cfb8b9d671a,2026-01-04T07:19:05Z,NewsAPI,
BCT and Weaver Win the 2025 ISG Paragon Award™ for Sustainability,https://www.thehindubusinessline.com/brandhub/pr-release/bct-and-weaver-win-the-2025-isg-paragon-awardtm-for-sustainability/article70481121.ece,2026-01-07T09:08:41Z,NewsAPI,
Matters To Consider for the 2026 Annual Meeting and Reporting Season: Disclosure Developments,https://corpgov.law.harvard.edu/2026/01/14/matters-to-consider-for-the-2026-annual-meeting-and-reporting-season-disclosure-developments/,2026-01-14T12:30:34Z,NewsAPI,
When transparency becomes folklore: turning B Corp skeptics into believers,https://www.creativeboom.com/news/when-corporate-transparency-becomes-folklore-turning-b-corp-skeptics-into-believers/,2026-01-07T07:45:00Z,NewsAPI,
BizClik Announces SGS-Led ESG Reporting & Regulation Workshop at Net Zero Summit 2026,https://www.prnewswire.co.uk/news-releases/bizclik-announces-sgs-led-esg-reporting--regulation-workshop-at-net-zero-summit-2026-302654035.html,2026-01-07T11:00:00Z,NewsAPI,
"Nejcennější na ESG jsou data, říká Serge Damian z CSG",https://www.idnes.cz/ekonomika/domaci/esg-serge-damian-csg-data-brusel.A260121_150527_ekonomika_iape,2026-01-29T13:14:00Z,NewsAPI,
Report: Man United will not sign Premier League star despite recent rumours,https://eplindex.com/142163/report-man-united-will-not-sign-premier-league-star-despite-recent-rumours.html,2026-01-30T10:45:00Z,NewsAPI,
"KhetiBuddy launches Verdnt, an AI-native SaaS platform for agribusinesses",https://www.thehindubusinessline.com/economy/agri-business/khetibuddy-launches-verdnt-an-ai-native-saas-platform-for-agribusinesses/article70555546.ece,2026-01-27T07:38:33Z,NewsAPI,
"Philippines (FM) Facility Management Market Share Analysis, Trends & Statistics, Growth Forecasts, 2026-2031 Featuring CBRE Philippines, Servicio Filipino, Meralco Industrial Engineering Services Corp. and More",https://www.globenewswire.com/news-release/2026/01/20/3221424/28124/en/Philippines-FM-Facility-Management-Market-Share-Analysis-Trends-Statistics-Growth-Forecasts-2026-2031-Featuring-CBRE-Philippines-Servicio-Filipino-Meralco-Industrial-Engineering-Se.html,2026-01-20T10:25:00Z,NewsAPI,
"In vet care deserts, an hour can be difference between life and death",https://www.abc.net.au/news/2026-01-15/australia-vet-care-access-deserts-life-and-death-for-animals/106229268,2026-01-14T21:25:48Z,NewsAPI,
"Newcastle United Transfer Latest: Kees Smit, Dayanne Mathalie and more",https://eplindex.com/141661/newcastle-united-transfer-latest-kees-smit-dayanne-mathalie-and-more.html,2026-01-20T21:20:00Z,NewsAPI,
EV-1 for Lease (1996),https://www.loe.org/shows/shows.html?programID=96-P13-00047#feature4,2026-01-29T22:36:21Z,NewsAPI,
Why US corporate enthusiasm matters more than federal pilot for regenerative agriculture,https://www.just-food.com/comment/why-us-corporate-enthusiasm-matters-more-than-federal-pilot-for-regenerative-agriculture/,2026-01-06T10:55:47Z,NewsAPI,
NPO to Tinubu: Regulate foreign platforms or lose Nigerian media,https://punchng.com/npo-to-tinubu-regulate-foreign-platforms-or-lose-nigerian-media/,2026-02-03T23:36:15Z,NewsAPI,
Indonesia Facility Management (FM) Market Analysis Report 2026-2031: Hybrid Work Models Enhance Occupancy Efficiency in Indonesia,https://www.globenewswire.com/news-release/2026/01/20/3221425/28124/en/Indonesia-Facility-Management-FM-Market-Analysis-Report-2026-2031-Hybrid-Work-Models-Enhance-Occupancy-Efficiency-in-Indonesia.html,2026-01-20T10:26:00Z,NewsAPI,
Essar Energy Transition reports record sales in 2025,https://www.thehindubusinessline.com/companies/essar-energy-transition-reports-record-sales-in-2025/article70509079.ece,2026-01-14T11:05:01Z,NewsAPI,
The Limited Effects of Regulating Greenwashing: Evidence from Europe’s SFDR,https://corpgov.law.harvard.edu/2026/02/03/the-limited-effects-of-regulating-greenwashing-evidence-from-europes-sfdr/,2026-02-03T12:31:27Z,NewsAPI,
Blackstone buys environmental services platform ATG from Morgan Stanley,https://www.esgdive.com/news/blackstone-buys-environmental-services-platform-atg-from-morgan-stanley/808997/,2026-01-07T12:47:04Z,NewsAPI,
"US policy factors 'critical' to extent of de-dollarisation shift, Morgan Stanley says",https://finance.yahoo.com/news/us-policy-factors-critical-extent-125732785.html,2026-01-21T12:57:32Z,NewsAPI,
IFRS Foundation’s CMAC appoints three new members,https://www.theaccountant-online.com/news/ifrs-foundations-cmac-appoints/,2026-01-08T10:00:48Z,NewsAPI,
India-EU trade agreement: Its success will be determined by the harder part that comes next,https://www.livemint.com/opinion/online-views/india-eu-pact-fta-exports-imports-pharma-apparel-tariffs-approval-market-access-11769587123368.html,2026-01-28T08:30:46Z,NewsAPI,
Four Million Miles of American Rivers Have Almost No Legal Shield,https://scienceblog.com/four-million-miles-of-american-rivers-have-almost-no-legal-shield/,2026-01-10T14:33:56Z,NewsAPI,
Remittances ‘more important than aid’ as Africa turns to stablecoins,https://cointelegraph.com/news/remittances-more-important-than-aid-africa-stablecoins,2026-01-23T20:56:37Z,NewsAPI,
BizClik Announces Watershed-Led AI & Sustainability Workshop at Net Zero Summit 2026,https://www.prnewswire.co.uk/news-releases/bizclik-announces-watershed-led-ai--sustainability-workshop-at-net-zero-summit-2026-302653834.html,2026-01-07T11:00:00Z,NewsAPI,
"Denim Industry Prepares for a Year of Risks, Sourcing Shifts and Regulations",https://sourcingjournal.com/denim/denim-business/denim-industry-prepares-risks-sourcing-shifts-regulations-1234797249/,2026-01-06T15:30:00Z,NewsAPI,
San Francisco Gay Men’s Chorus seeks Chief Executive Officer,https://www.artsjournal.com/2026/01/san-francisco-gay-mens-chorus-seeks-chief-executive-officer.html,2026-01-21T03:25:34Z,NewsAPI,
Why should you release bass?,https://www.lifesciencesworld.com/why-should-you-release-bass/,2026-01-10T07:38:57Z,NewsAPI,
"India@Davos: Leaders highlight economic growth, sustainability roadmap",https://economictimes.indiatimes.com/news/india/indiadavos-leaders-highlight-economic-growth-sustainability-roadmap/articleshow/126996913.cms,2026-01-21T13:52:18Z,NewsAPI,
Chalkis Shipyards: Carbon Footprint Report,https://www.naftemporiki.gr/english/2059541/chalkis-shipyards-carbon-footprint-report/,2026-01-16T09:40:38Z,NewsAPI,
온실가스 저감 증명 시스템으로 환경 규제 측정·보고·검증 통합 플랫폼 구축…정종현 HSE 대표,https://www.venturesquare.net/1029958,2026-01-04T06:09:04Z,NewsAPI,
온실가스 저감 증명 시스템으로 환경 규제 측정·보고·검증 통합 플랫폼 구축…정종현 HSE 대표,https://www.venturesquare.net/1029958/,2026-01-04T07:36:34Z,NewsAPI,
BizClik Launches January 2026 Sustainability Portfolio With Insights From Novartis and Amazon,https://www.globenewswire.com/news-release/2026/01/08/3215166/0/en/BizClik-Launches-January-2026-Sustainability-Portfolio-With-Insights-From-Novartis-and-Amazon.html,2026-01-08T11:31:00Z,NewsAPI,
"Investors Reward Companies That Actually Do Good, Not Just Talk About It",https://scienceblog.com/investors-reward-companies-that-actually-do-good-not-just-talk-about-it/,2026-01-08T14:13:56Z,NewsAPI,
"Fort Worth Symphony Orchestra seeks Vice President, Marketing and PR",https://www.artsjournal.com/2026/01/fort-worth-symphony-orchestra-seeks-vice-president-marketing-and-pr.html,2026-01-21T21:26:13Z,NewsAPI,
A new era for energy and sustainability: Schneider Electric announces Resource Advisor+,https://financialpost.com/globe-newswire/a-new-era-for-energy-and-sustainability-schneider-electric-announces-resource-advisor,2026-01-20T14:32:23Z,NewsAPI,
"Cloud Sustainability Market Set to Hit USD 147.07 Billion by 2032, Driven by ESG Compliance and Net-Zero Commitments | SNS Insider",https://www.globenewswire.com/news-release/2026/01/08/3215137/0/en/Cloud-Sustainability-Market-Set-to-Hit-USD-147-07-Billion-by-2032-Driven-by-ESG-Compliance-and-Net-Zero-Commitments-SNS-Insider.html,2026-01-08T10:17:00Z,NewsAPI,
Restaking promises yield but delivers only stacked risk and no real value,https://cointelegraph.com/news/restaking-delivers-risk,2026-01-23T12:30:00Z,NewsAPI,
"법무법인 원, ABLJ ‘2025 한국 로펌 어워드’ 3개 부문 수상",https://www.venturesquare.net/1035720/,2026-01-28T05:18:30Z,NewsAPI,
"Qld health services facing financial black hole of almost $1 billion, report finds",https://www.abc.net.au/news/2026-01-20/qld-health-blowout-hospital-report/106249992,2026-01-20T06:57:06Z,NewsAPI,
Childminders 'under threat' from tax changes,https://www.bbc.com/news/articles/cn40g8eewk9o,2026-01-13T05:59:48Z,NewsAPI,
Future-Proof Your Data Center for AI: A Checklist for Designing and Building AI Data Centers,https://blogs.cisco.com/insidervoices/insidervoices-ai-data-center-design-checklist,2026-01-07T19:59:17Z,NewsAPI,
A new era for energy and sustainability: Schneider Electric announces Resource Advisor+,https://www.globenewswire.com/news-release/2026/01/20/3221870/0/en/A-new-era-for-energy-and-sustainability-Schneider-Electric-announces-Resource-Advisor.html,2026-01-20T14:30:00Z,NewsAPI,
The role of CFOs in sustainability strategies,https://www.techtarget.com/sustainability/feature/The-role-of-CFOs-in-sustainability-strategies,2026-01-09T12:54:00Z,NewsAPI,
Lifestyle Guest Posting Sites – 15 Places That Still Accept Pitches (and how to get accepted),https://www.smashingapps.com/15-lifestyle-guest-posting-sites/,2026-01-29T08:37:49Z,NewsAPI,
"Riikka Tieaho appointed Executive Vice President, Sustainability, Corporate Affairs & Legal, and General Counsel",https://www.globenewswire.com/news-release/2026/01/30/3229252/0/en/Riikka-Tieaho-appointed-Executive-Vice-President-Sustainability-Corporate-Affairs-Legal-and-General-Counsel.html,2026-01-30T08:00:00Z,NewsAPI,
Use Semrush to Benchmark Brand Mentions in AI Answers,https://www.semrush.com/blog/benchmark-brand-mentions-in-ai-answers-semrush/,2026-01-13T14:45:00Z,NewsAPI,
Bureau Veritas to acquire a leading Sustainability specialist for consumer products in Italy,https://www.globenewswire.com/news-release/2026/01/23/3224968/0/en/Bureau-Veritas-to-acquire-a-leading-Sustainability-specialist-for-consumer-products-in-Italy.html,2026-01-23T16:45:00Z,NewsAPI,
Sustainability and ESG Strategy Consulting,https://www.ey.com/en_us/services/strategy-transactions/sustainability-esg-strategy,,SerpAPI,"Our Sustainability and ESG Strategy Consulting teams can help you with strategy, M&A, capital allocation, ESG due diligence and portfolio optimization."
Top 4 ESG & Sustainability Advisory Firms | Corporate News,https://boardroompulse.com/top-esg-sustainability-advisory-firms/,,SerpAPI,Top 4 ESG & Sustainability Advisory Firms · 1. Sustainalytics · 2. MSCI ESG Research · 3. ERM Group · 4. PwC ESG Advisory. With deep capabilities in ESG risk ...
ESG consulting | Services,https://rsmus.com/services/business-strategy-operations/enterprise-strategy-services/environmental-social-governance-advisory.html,,SerpAPI,RSM's core offering of ESG and sustainability consulting provides the foundation for a successful ESG journey. We advise on ESG readiness and strategy ...
Top 10: Sustainable Consulting Firms,https://sustainabilitymag.com/top10/top-10-sustainable-consulting-firms,,SerpAPI,"The top 10 sustainable consulting firms include McKinsey & Company, EY and ERM. Businesses are under pressure to become more sustainable."
Top ESG consulting firms in the US,https://www.consulting.us/rankings/top-consulting-firms-in-the-us-by-area-of-expertise/esg,,SerpAPI,What are the top ESG consulting firms in the US? Our guide of leading consulting firms presents America's top consultancy firms specialised in ESG.
Sustainability Planning Services - Antea Group,https://us.anteagroup.com/services/esg-advisory-services,,SerpAPI,"At Antea®Group, our consultants provide advisory to help clients navigate, understand, and proactively manage their ESG risks and opportunities."
"Environmental, Social and Governance (ESG) Consulting",https://www.ajg.com/services/esg-consulting/,,SerpAPI,"We help our clients evaluate their Environmental, Social and Governance (ESG) needs and goals, and support the execution of those plans wherever possible."
ESG Advisory,https://www.maynardnexsen.com/capabilities-esg,,SerpAPI,"Maynard Nexsen's ESG Advisory Group counsels public and private companies on environmental, social and governance (ESG) compliance and disclosure issues."
ESG Advisory Services,https://www.ifc.org/en/what-we-do/sector-expertise/sustainability/esg-advisory-services,,SerpAPI,IFC is a global ESG market leader with expertise and extensive experience in addressing ESG challenges in emerging markets and developing economies.
Top 7 ESG Consulting Firms in 2025 | Blog | ASUENE,https://asuene.com/us/blog/top-7-esg-consulting-firms-in-2025,,SerpAPI,"While firms like BCG, PwC, Deloitte, ERM, and South Pole each offer valuable strengths, Asuene distinguishes itself by offering a complete, ..."
