title,url,publishedAt,source,snippet
What It Will Take to Make AI Sustainable,https://www.wired.com/story/what-it-will-take-to-make-ai-sustainable/,2026-05-13T19:15:59Z,NewsAPI,
A crocodile crushed this diver’s only functional arm. He returned to the water to fight plastic pollution,https://www.cnn.com/world/alain-brandeleer-crocodile-attack-ocean-cleanup-c2e-spc,2026-05-18T12:22:31Z,NewsAPI,
Google Chrome Might Have Installed an AI Model Onto Your Device Without You Knowing,https://www.cnet.com/tech/services-and-software/chrome-installing-4gb-ai-model-gemini-nano/,2026-05-06T21:31:00Z,NewsAPI,
Fact-checking organizations awarded IFCN grants to encourage financial sustainability work,https://www.poynter.org/ifcn/2026/fact-checking-organizations-awarded-ifcn-grants-to-encourage-financial-sustainability-work/,2026-05-07T10:30:55Z,NewsAPI,
The next era of SaaS efficiency: Where sustainability becomes a core metric,https://www.techradar.com/pro/the-next-era-of-saas-efficiency-where-sustainability-becomes-a-core-metric,2026-04-29T09:12:07Z,NewsAPI,
"AngloGold Ashanti AGM: Record $2.9B Free Cash Flow, Dividend, Nevada Growth; Obuasi Fatality Addressed",https://www.marketbeat.com/instant-alerts/anglogold-ashanti-agm-record-29b-free-cash-flow-dividend-nevada-growth-obuasi-fatality-addressed-2026-05-06/?utm_source=yahoofinance&amp;utm_medium=yahoofinance,2026-05-06T11:09:25Z,NewsAPI,
"Did Chrome Just Install a Massive AI Model on Your Device Without Telling You? Yes, Probably",https://www.cnet.com/tech/services-and-software/did-chrome-just-install-a-massive-ai-model-on-your-device-without-telling-you-yes-probably/,2026-05-15T00:00:49Z,NewsAPI,
Google Chrome silently installs a 4 GB AI model on your device without consent,https://www.thatprivacyguy.com/blog/chrome-silent-nano-install,2026-05-05T07:34:55Z,NewsAPI,
ACCA says sustainability reporting can boost growth in UK and China,https://www.theaccountant-online.com/news/acca-says-sustainability-reporting-can-boost-growth-in-uk-and-china/,2026-05-07T14:52:24Z,NewsAPI,
"Why we should feel hopeful this Earth Day 2026, according to these changemakers, activists and scientists",https://adventure.com/climate-change-clean-air-water-pollution-earth-day-2026-hope/,2026-04-20T18:00:00Z,NewsAPI,
Realty Income Q1 Earnings Call Highlights,https://www.marketbeat.com/instant-alerts/realty-income-q1-earnings-call-highlights-2026-05-13/?utm_source=yahoofinance&amp;utm_medium=yahoofinance,2026-05-13T11:07:40Z,NewsAPI,
C&L 2026 May Donation Drive,https://crooksandliars.com/2026/05/cl-2026-may-donation-drive,2026-05-12T11:07:45Z,NewsAPI,
West Brom given points deduction for breaching EFL financial rules,https://www.skysports.com/football/news/11698/13535990/west-brom-handed-immediate-two-point-deduction-in-championship-for-breaching-efl-financial-rules,2026-04-24T16:00:00Z,NewsAPI,
SEC pushes stronger sustainability reporting to attract investors,https://punchng.com/sec-pushes-stronger-sustainability-reporting-to-attract-investors/,2026-05-05T23:23:30Z,NewsAPI,
Why messy data will make your company’s AI bill much higher than expected,https://www.techradar.com/pro/why-messy-data-will-make-your-companys-ai-bill-much-higher-than-expected,2026-05-06T12:35:38Z,NewsAPI,
SEC flags weak sustainability reporting among Nigerian companies,https://punchng.com/sec-flags-weak-sustainability-reporting-among-nigerian-companies/,2026-05-05T16:52:57Z,NewsAPI,
C&L's May Donation And Subscription Drive,https://crooksandliars.com/2026/05/cls-may-donation-and-subscription-drive,2026-05-06T11:16:31Z,NewsAPI,
"Pablo Torre's podcast wins Pulitzer Prize for Clippers report, capping a remarkable rise",https://sports.yahoo.com/articles/pablo-torres-podcast-wins-pulitzer-220555102.html,2026-05-04T22:05:55Z,NewsAPI,
New Poynter hub serves journalists working with AI and audiences trying to make sense of it,https://www.poynter.org/reporting-editing/2026/new-poynter-hub-serves-journalists-working-with-ai-and-audiences-trying-to-make-sense-of-it/,2026-05-14T11:00:22Z,NewsAPI,
"LAFC, Owners Of Swiss Soccer Club, Offer To Sell After Fans' Forceful Protest",https://www.foxsports.com/stories/soccer/los-angelesbased-owners-of-swiss-soccer-club-offer-to-sell-after-fans-forceful-protest,2026-04-29T00:39:26Z,NewsAPI,
Mastering Advanced Writing Niches: A Guide to Specializing and Earning More in 2026,https://freelancewritinggigs.com/mastering-advanced-writing-niches-a-guide-to-specializing-and-earning-more-in-2026/,2026-04-20T18:22:28Z,NewsAPI,
The Water Lie Data Centers Are Selling Us,https://www.naturalnews.com/2026-05-18-water-lie-data-centers-are-selling-us.html,2026-05-18T06:00:00Z,NewsAPI,
Nueva ISO 14001: los cambios que llegan,https://www.expansion.com/economia-sostenible/2026/05/06/69f9f8e3e5fdeaad268b4596.html,2026-05-05T22:24:03Z,NewsAPI,
Magnera Q2 Earnings Call Highlights,https://www.marketbeat.com/instant-alerts/magnera-q2-earnings-call-highlights-2026-05-11/?utm_source=yahoofinance&amp;utm_medium=yahoofinance,2026-05-11T12:04:49Z,NewsAPI,
Am I Meant to Be Impressed?,https://www.wheresyoured.at/am-i-meant-to-be-impressed/,2026-05-06T15:21:08Z,NewsAPI,
Energy Will Define the Scale of AI,https://blogs.cisco.com/?p=490094,2026-04-22T12:00:51Z,NewsAPI,
‘Pablo Torre Finds Out’ staff wins Pulitzer Prize in Audio Reporting.,https://awfulannouncing.com/podcasts/pablo-torre-finds-out-pulitzer-prize-audio-reporting.html,2026-05-04T20:45:25Z,NewsAPI,
馬來西亞最大上市公司首入永續報告週期 準備度顯現落差,https://tw.stock.yahoo.com/news/%E9%A6%AC%E4%BE%86%E8%A5%BF%E4%BA%9E%E6%9C%80%E5%A4%A7%E4%B8%8A%E5%B8%82%E5%85%AC%E5%8F%B8%E9%A6%96%E5%85%A5%E6%B0%B8%E7%BA%8C%E5%A0%B1%E5%91%8A%E9%80%B1%E6%9C%9F-%E6%BA%96%E5%82%99%E5%BA%A6%E9%A1%AF%E7%8F%BE%E8%90%BD%E5%B7%AE-080306746.html,2026-05-18T08:03:06Z,NewsAPI,
What Happens When The Attribution Cartel Meets Advertising’s Halo Effect?,http://www.adexchanger.com/data-driven-thinking/what-happens-when-the-attribution-cartel-meets-advertisings-halo-effect/,2026-04-20T04:35:24Z,NewsAPI,
The Outside View: Fashion Can’t Afford to Wait on Digital Product Passports,http://wwd.com/sustainability/business/fashion-digital-product-passport-readiness-1238926837/,2026-04-23T19:53:59Z,NewsAPI,
Franco-Nevada Launches 2026 Asset Handbook and Sustainability Report,https://www.prnewswire.com/news-releases/franco-nevada-launches-2026-asset-handbook-and-sustainability-report-302764681.html,2026-05-06T20:30:00Z,NewsAPI,
Are Companies’ A.I. Ambitions on a Collision Course With Their Sustainability Goals?,https://observer.com/2026/04/ai-adoption-energy-demand-corporate-esg/,2026-04-21T19:00:56Z,NewsAPI,
“I’m disgusted to be a human”: What to do when you hate your own species,https://www.vox.com/future-perfect/488114/anti-humanism-climate-anthropocene-hope-buddhism,2026-05-08T19:46:00Z,NewsAPI,
Departure for Newcastle star now seems likely,https://eplindex.com/145871/departure-for-newcastle-star-now-seems-likely.html,2026-04-29T06:50:00Z,NewsAPI,
Report: Newcastle United set £75m price tag on star amid interest from European giants,https://eplindex.com/145566/report-newcastle-united-set-75m-price-tag-on-star-amid-interest-from-european-giants.html,2026-04-21T09:50:00Z,NewsAPI,
"Auto racing may not seem green, but IMS takes eco-friendly steps",https://www.indystar.com/story/news/environment/2026/05/18/indianapolis-motor-speedway-sustainability-goals-carbon-impact/89934938007/,2026-05-18T09:24:31Z,NewsAPI,
Is quarterly reporting hurting investors or helping them? The SEC just weighed in—and the debate is far from over,https://fortune.com/2026/05/08/sec-proposal-quarterly-reporting-semiannual-investors-cfo/,2026-05-08T11:26:15Z,NewsAPI,
Fidelity sends blunt message on S&P 500 after sudden rebound,https://www.thestreet.com/investing/fidelity-sends-blunt-message-on-sp-500-after-sudden-rebound,2026-04-24T17:33:00Z,NewsAPI,
"Etsy, Amazon, eBay, and Shopify in April: Why E-Commerce Stocks Diverged So Dramatically",https://247wallst.com/investing/2026/05/04/etsy-amazon-ebay-and-shopify-in-april-why-e-commerce-stocks-diverged-so-dramatically/,2026-05-04T14:06:44Z,NewsAPI,
"US oil refiners finally profit from biofuels due to mandates, high fuel prices",https://finance.yahoo.com/sectors/energy/articles/us-oil-refiners-finally-profit-174610199.html,2026-05-15T17:46:10Z,NewsAPI,
From fields to forecasts: The new age of farm data platforms,https://www.thehindubusinessline.com/economy/agri-business/from-fields-to-forecasts-the-new-age-of-farm-data-platforms/article70929388.ece,2026-05-02T03:20:47Z,NewsAPI,
How do lobbying affect ESG disclosures? #science,https://alltoc.com/science/how-do-lobbying-affect-esg-disclosures,2026-05-02T00:02:46Z,NewsAPI,
Telia Lietuva annual information for the year 2025,https://www.globenewswire.com/news-release/2026/04/27/3281649/0/en/Telia-Lietuva-annual-information-for-the-year-2025.html,2026-04-27T13:00:00Z,NewsAPI,
"NEW RESEARCH: Corporates Ready to Move Forward on Carbon Removal Purchasing, But Seek Policy Clarity",https://www.prnewswire.com/news-releases/new-research-corporates-ready-to-move-forward-on-carbon-removal-purchasing-but-seek-policy-clarity-302773299.html,2026-05-19T04:01:00Z,NewsAPI,
Solar On The Farm: The Benefits Of Agrivoltaics,https://www.forbes.com/sites/current-climate/2026/05/11/integrating-solar-on-the-farm/,2026-05-11T13:00:00Z,NewsAPI,
Sustainability & AI Panel at Sustainability LIVE @ London Climate Action Week 2026,https://www.globenewswire.com/news-release/2026/04/30/3285030/0/en/Sustainability-AI-Panel-at-Sustainability-LIVE-London-Climate-Action-Week-2026.html,2026-04-30T13:47:00Z,NewsAPI,
HUDCO shares crash 8% despite 172% YoY surge in Q4 net profit. What's spooking investors?,https://economictimes.indiatimes.com/markets/stocks/news/hudco-shares-crash-8-despite-172-yoy-surge-in-q4-net-profit-whats-spooking-investors/articleshow/131109926.cms,2026-05-15T06:18:23Z,NewsAPI,
Heartland Institute Podcast Questions Whether All Americans ‘Should Have the Right to Vote’,https://www.nakedcapitalism.com/2026/05/heartland-institute-podcast-questions-whether-all-americans-should-have-the-right-to-vote.html,2026-05-07T06:00:24Z,NewsAPI,
West Brom hit back at decision to dock club two points for financial rule breach,https://hayters.com/west-brom-hit-back-at-decision-to-dock-club-two-points-for-financial-rule-breach/,2026-04-24T17:35:00Z,NewsAPI,
Sight Sciences Announces the Release of its Sustainability Report,https://www.globenewswire.com/news-release/2026/04/22/3279439/0/en/Sight-Sciences-Announces-the-Release-of-its-Sustainability-Report.html,2026-04-22T20:45:00Z,NewsAPI,
"Stantec releases 19th annual Sustainability Report, highlighting 68% (C$5.5 billion) in sustainability-driven revenue",https://www.globenewswire.com/news-release/2026/04/21/3277748/0/en/Stantec-releases-19th-annual-Sustainability-Report-highlighting-68-C-5-5-billion-in-sustainability-driven-revenue.html,2026-04-21T10:45:00Z,NewsAPI,
"Wynn Resorts Publishes 2025 ESG Report Detailing ESG Progress Across Workforce Development, Philanthropy and Environmental Stewardship",https://www.prnewswire.com/news-releases/wynn-resorts-publishes-2025-esg-report-detailing-esg-progress-across-workforce-development-philanthropy-and-environmental-stewardship-302765827.html,2026-05-07T17:00:00Z,NewsAPI,
Watershed Launches New AI Agents and Sustainability AI Fellowship,https://www.globenewswire.com/news-release/2026/04/21/3277603/0/en/Watershed-Launches-New-AI-Agents-and-Sustainability-AI-Fellowship.html,2026-04-21T07:00:00Z,NewsAPI,
Balchem Corporation Releases 2025 Sustainability Report,https://www.globenewswire.com/news-release/2026/04/22/3278831/8153/en/Balchem-Corporation-Releases-2025-Sustainability-Report.html,2026-04-22T11:10:00Z,NewsAPI,
"Federal Pipeline Regulator Rarely Enforces Safety Rules, New Analysis Shows",https://michiganadvance.com/2026/05/08/u-m-report-says-federal-pipeline-regulators-rarely-enforce-safety-rules-leaving-line-5-at-risk/,2026-05-08T16:45:19Z,NewsAPI,
"Mega-Cap Earnings, FOMC and Other Key Things to Watch this Week",https://www.barchart.com/story/news/1525397/mega-cap-earnings-fomc-and-other-key-things-to-watch-this-week,2026-04-26T17:00:02Z,NewsAPI,
"The UAE didn’t have a space agency twelve years ago. It now has a probe at Mars, a seat at the UN’s new space-safety body, and a plan to be in the global top 10 by 2031.",https://spacedaily.com/m-the-uae-didnt-have-a-space-agency-twelve-years-ago-it-now-has-a-probe-at-mars-a-seat-at-the-uns-new-space-safety-body-and-a-plan-to-be-in-the-global-top-10-by-2031/,2026-05-18T14:09:09Z,NewsAPI,
Copenhagen isn't restricting seniors' beef intake. The limit is only guidance,https://www.snopes.com//fact-check/copenhagen-denmark-beef-limit/,2026-05-18T10:00:00Z,NewsAPI,
Nordic Climate Group publishes Sustainability Report for 2025,https://www.globenewswire.com/news-release/2026/05/06/3288530/0/en/Nordic-Climate-Group-publishes-Sustainability-Report-for-2025.html,2026-05-06T07:54:00Z,NewsAPI,
Prince William awkwardly cracked some ‘jokes’ about AI replacing racecar drivers,https://www.celebitchy.com/973638/prince_william_awkwardly_cracked_some_jokes_about_ai_replacing_racecar_drivers/,2026-04-24T11:25:04Z,NewsAPI,
Lundin Mining Publishes 2025 Sustainability Statement and 2025 Annual Report,https://www.prnewswire.co.uk/news-releases/lundin-mining-publishes-2025-sustainability-statement-and-2025-annual-report-302756569.html,2026-04-29T03:30:00Z,NewsAPI,
"Managing Director, Sarasota Opera",https://www.artsjournal.com/2026/05/managing-director-sarasota-opera.html,2026-05-11T17:01:50Z,NewsAPI,
NORBIT ASA - Annual Report for 2025,https://www.globenewswire.com/news-release/2026/04/23/3279567/0/en/NORBIT-ASA-Annual-Report-for-2025.html,2026-04-23T05:30:00Z,NewsAPI,
Missing lens: markets must put a price tag on the climate risks that companies face,https://www.livemint.com/opinion/online-views/markets-price-tag-climate-risks-companies-stock-market-oil-corporate-performance-india-inc-11778605893895.html,2026-05-13T06:30:13Z,NewsAPI,
Spartan Companies Selects ISN® to Help Strengthen Subcontractor Management,https://www.globenewswire.com/news-release/2026/04/23/3280124/0/en/Spartan-Companies-Selects-ISN-to-Help-Strengthen-Subcontractor-Management.html,2026-04-23T14:12:00Z,NewsAPI,
Melco publishes 2025 Sustainability Report “RISE to Go Above & Beyond”,https://www.globenewswire.com/news-release/2026/05/04/3286485/0/en/Melco-publishes-2025-Sustainability-Report-RISE-to-Go-Above-Beyond.html,2026-05-04T09:28:00Z,NewsAPI,
VALLOUREC CONFIRMS ITS PLATINUM MEDAL FROM ECOVADIS FOR SUSTAINABILITY PERFORMANCE,https://www.globenewswire.com/news-release/2026/05/11/3291542/0/en/VALLOUREC-CONFIRMS-ITS-PLATINUM-MEDAL-FROM-ECOVADIS-FOR-SUSTAINABILITY-PERFORMANCE.html,2026-05-11T05:00:00Z,NewsAPI,
Lerøy Seafood Group ASA: Integrated annual report for 2025,https://www.globenewswire.com/news-release/2026/04/30/3284484/0/en/Ler%C3%B8y-Seafood-Group-ASA-Integrated-annual-report-for-2025.html,2026-04-30T06:30:00Z,NewsAPI,
SpaceX’s IPO Could Leave Tesla Eating Rocket Dust,https://www.forbes.com/sites/alanohnsman/2026/04/23/spacexs-ipo-could-leave-tesla-eating-rocket-dust/,2026-04-23T10:30:00Z,NewsAPI,
Netflix Boards Recommends ‘No’ Votes On Two ‘Anti-Woke’ Proposals,https://www.forbes.com/sites/rickellis/2026/04/23/netflix-boards-recommends-no-votes-on-two-anti-woke-proposals/,2026-04-23T21:26:43Z,NewsAPI,
"The Fertility Panic Is a Racist, Sexist Tool to Push More Austerity",https://www.nakedcapitalism.com/2026/05/the-fertility-panic-is-a-racist-sexist-tool-to-push-more-austerity.html,2026-05-05T13:55:57Z,NewsAPI,
csrd-compliance-mcp 1.2.3,https://pypi.org/project/csrd-compliance-mcp/1.2.3/,2026-05-07T10:28:52Z,NewsAPI,
csrd-compliance-mcp 1.0.1,https://pypi.org/project/csrd-compliance-mcp/1.0.1/,2026-05-07T06:42:28Z,NewsAPI,
csrd-compliance-mcp 1.1.0,https://pypi.org/project/csrd-compliance-mcp/1.1.0/,2026-04-23T08:50:32Z,NewsAPI,
csrd-compliance-mcp 1.2.0,https://pypi.org/project/csrd-compliance-mcp/1.2.0/,2026-04-23T09:04:12Z,NewsAPI,
Influential Brands® celebrates Asia’s finest in business excellence at the Fullerton Hotel,https://www.thehindubusinessline.com/brandhub/pr-release/influential-brands-celebrates-asias-finest-in-business-excellence-at-the-fullerton-hotel/article70887522.ece,2026-04-21T11:36:50Z,NewsAPI,
Power to cut funding and stricter 'permanence' test under new NDIS,https://www.abc.net.au/news/2026-05-14/ndis-legislation-funding-cut-powers-civil-penalties/106677970,2026-05-14T04:11:08Z,NewsAPI,
What Financial Survival in Higher Ed Looks Like,https://www.insidehighered.com/opinion/columns/editors-note/2026/05/07/what-financial-survival-higher-ed-looks,2026-05-07T07:00:00Z,NewsAPI,
Clippers owner Steve Ballmer sends letter to judge detailing misgivings of Aspiration co-founder Joe Sanberg ahead of sentencing,https://sports.yahoo.com/nba/article/clippers-owner-steve-ballmer-sends-letter-to-judge-detailing-misgivings-of-aspiration-co-founder-joe-sanberg-ahead-of-sentencing-171645112.html,2026-04-23T17:16:45Z,NewsAPI,
"Growscape Launches Revolutionary EarthSafe Sustainability Platform, Setting New Industry Standard",https://www.globenewswire.com/news-release/2026/04/22/3278836/0/en/Growscape-Launches-Revolutionary-EarthSafe-Sustainability-Platform-Setting-New-Industry-Standard.html,2026-04-22T11:15:00Z,NewsAPI,
Climate Change Weekly # 578— Countries and Industries Are Abandoning or Reducing Net-Zero Commitments,https://wattsupwiththat.com/2026/05/02/climate-change-weekly-578-countries-and-industries-are-abandoning-or-reducing-net-zero-commitments/,2026-05-03T01:00:00Z,NewsAPI,
NEMO Partners with Storm Care Solutions as Exclusive US Distributor,https://soldiersystems.net/2026/05/02/nemo-partners-with-storm-care-solutions-as-exclusive-us-distributor/,2026-05-02T17:00:00Z,NewsAPI,
Build an Autonomous AI Agent System in Under 30 Minutes,https://www.geeky-gadgets.com/openclaw-setup-guide-2026/,2026-04-29T09:45:00Z,NewsAPI,
Sustainability and ESG consulting,https://rsmus.com/services/business-strategy-operations/enterprise-strategy-services/environmental-social-governance-advisory.html,,SerpAPI,"RSM provides sustainability and ESG consulting, strategy and advisory services integrating sustainability and ESG into overall strategy to drive value."
Sustainability and ESG Strategy Consulting,https://www.ey.com/en_us/services/strategy-transactions/sustainability-esg-strategy,,SerpAPI,"Our Sustainability and ESG Strategy Consulting teams can help you with strategy, M&A, capital allocation, ESG due diligence and portfolio optimization."
Top ESG consulting firms in the US,https://www.consulting.us/rankings/top-consulting-firms-in-the-us-by-area-of-expertise/esg,,SerpAPI,What are the top ESG consulting firms in the US? Our guide of leading consulting firms presents America's top consultancy firms specialised in ESG.
"Environmental, Social and Governance (ESG) Consulting",https://www.ajg.com/services/esg-consulting/,,SerpAPI,"We help our clients evaluate their Environmental, Social and Governance (ESG) needs and goals, and support the execution of those plans wherever possible."
ESG Advisory Services,https://www.ifc.org/en/what-we-do/sector-expertise/sustainability/esg-advisory-services,,SerpAPI,IFC is a global ESG market leader with expertise and extensive experience in addressing ESG challenges in emerging markets and developing economies.
ESG Consulting: Top Challenges for Advisors in 2026,https://www.manifestclimate.com/blog/esg-consulting/,,SerpAPI,"ESG consulting firms are expanding, and specialists with certifications may have an edge over generalists or professionals pivoting into ESG ..."
ESG Consulting Services,https://riveron.com/services/esg-consulting/,,SerpAPI,"Companies need ESG consulting expertise rooted in deep, fundamental knowledge of effective ESG goals and strategy, material ESG metrics, and verifiable ESG ..."
Top ESG consulting firms in Europe,https://www.consultancy.eu/rankings/top-consulting-firms-in-europe-by-area-of-expertise/esg,,SerpAPI,"The top ESG consulting firms in Europe list presents the country's leading consultancy firms specialised in ESG, based on our unique database of more than 2 ..."
Top 7 ESG Consulting Firms in 2025 | Blog | ASUENE,https://asuene.com/us/blog/top-7-esg-consulting-firms-in-2025,,SerpAPI,"PwC Sustainability provides extensive ESG assurance services, regulatory advisory, and risk management solutions. With a presence in over 150 ..."
ESG Consulting,https://www.georgeson.com/us/business/esg,,SerpAPI,"Georgeson's ESG consulting services help you understand your ESG regulatory landscape, advance your ESG practice and communicate with investors effectively."
